{
  "schema_version": "1.0.0",
  "dataset_id": "d4-solana-holdout-v1",
  "description": "Holdout Solana/Anchor set reserved for final scoring (not for prompt tuning).",
  "created_at": "2026-02-15",
  "repos": [
    {
      "id": "repo-holdout-1",
      "path": "golden_repos/solana_holdout_v1/repo-holdout-1",
      "language": "rust",
      "framework": "anchor",
      "expected_findings": [
        {
          "vuln_class": "missing_signer_check",
          "severity": "HIGH",
          "file": "src/lib.rs",
          "line": 10,
          "title": "Missing signer check on authority account"
        },
        {
          "vuln_class": "cpi_reentrancy",
          "severity": "CRITICAL",
          "file": "src/lib.rs",
          "line": 16,
          "title": "Potential CPI reentrancy path"
        }
      ]
    },
    {
      "id": "repo-holdout-2",
      "path": "golden_repos/solana_holdout_v1/repo-holdout-2",
      "language": "rust",
      "framework": "anchor",
      "expected_findings": [
        {
          "vuln_class": "non_canonical_bump",
          "severity": "HIGH",
          "file": "src/lib.rs",
          "line": 10,
          "title": "Non-canonical bump handling"
        },
        {
          "vuln_class": "missing_has_one",
          "severity": "HIGH",
          "file": "src/lib.rs",
          "line": 16,
          "title": "Missing has_one relationship constraint"
        }
      ]
    }
  ]
}
