{
  "schema_version": "1.0.0",
  "dataset_id": "d2-solana-seeded-v2",
  "description": "Extended Solana/Anchor seeded benchmark with mixed scanner classes and control repos.",
  "created_at": "2026-02-15",
  "repos": [
    {
      "id": "repo-template-c",
      "path": "golden_repos/solana_seeded_v2/repo-template-c",
      "language": "rust",
      "framework": "anchor",
      "expected_findings": [
        {
          "vuln_class": "missing_has_one",
          "severity": "HIGH",
          "file": "src/lib.rs",
          "line": 11,
          "title": "Missing has_one relationship constraint"
        },
        {
          "vuln_class": "cpi_signer_seed_bypass",
          "severity": "CRITICAL",
          "file": "src/lib.rs",
          "line": 17,
          "title": "Signer seed validation weakness in CPI"
        },
        {
          "vuln_class": "seed_collision",
          "severity": "HIGH",
          "file": "src/lib.rs",
          "line": 23,
          "title": "PDA seed collision risk"
        }
      ]
    },
    {
      "id": "repo-template-d",
      "path": "golden_repos/solana_seeded_v2/repo-template-d",
      "language": "rust",
      "framework": "anchor",
      "expected_findings": [
        {
          "vuln_class": "arbitrary_cpi",
          "severity": "CRITICAL",
          "file": "src/lib.rs",
          "line": 11,
          "title": "Arbitrary CPI target risk"
        },
        {
          "vuln_class": "account_type_confusion",
          "severity": "HIGH",
          "file": "src/lib.rs",
          "line": 18,
          "title": "Account type confusion risk"
        },
        {
          "vuln_class": "attacker_controlled_seed",
          "severity": "HIGH",
          "file": "src/lib.rs",
          "line": 24,
          "title": "Attacker-controlled PDA seed component"
        }
      ]
    },
    {
      "id": "repo-template-e",
      "path": "golden_repos/solana_seeded_v2/repo-template-e",
      "language": "rust",
      "framework": "anchor",
      "expected_findings": []
    }
  ]
}
